<?xml version="1.0"?>
<Report xmlns:xsi="http://www.w3.org/2001/XMLSchema-instance" xsi:noNamespaceSchemaLocation="TransactionFK.xsd">
        <General>
                <header>asd</header>
                <footer>dede</footer>
                <fromDate>20150910</fromDate>
                <toDate>20150910</toDate>
        </General>	
        <Transaction>
                <id>11</id>
		<idMerchant>1</idMerchant>
		<idTerminal>2</idTerminal>
		<idClient>3</idClient>
		<operation>01</operation>
		<requestId>12345</requestId>
		<maskCardNumber>1234567890987654</maskCardNumber>
		<payoutAmount>100</payoutAmount>
		<feeAmount>3</feeAmount>
		<amount>103</amount>
		<dateTime>20150910</dateTime>
		<type>R</type>
		<checkNumber>321321321</checkNumber>
		<makerName>adasdasd</makerName>
		<resultMessage>This is Test Data. No data available.</resultMessage>
                <resultCode>0</resultCode>
	</Transaction>
	<Merchant>
		<id>1</id>
		<legalName>lolo</legalName>
		<description>qaqweqwe</description>
		<sic>111</sic>
		<address>adasdasd</address>
                <zipcode>12345</zipcode>
                <state>as</state>
                <city>asdasdasd</city>
                <phone>123123123123</phone>
                <idPosOrderExp>1231231231</idPosOrderExp>
                <idTellerOrderExp>111333</idTellerOrderExp>
                <oEAgentNumber>123123123</oEAgentNumber>
                <customerName>asdasd</customerName>
	</Merchant>
	<Terminal>
		<id>2</id>
                <serialNumber>1234567889</serialNumber>
                <description>aaaaaa</description>
                <merchantName>asdasd</merchantName>
	</Terminal>
	<Client>
		<id>3</id>
                <first>qwqw</first>
                <last>asas</last>
                <phone>123456789</phone>
	</Client>
</Report>